{
  "$id": "urn:aniukas-lossless-memory:format:1:log-manifest",
  "$schema": "https://json-schema.org/draft/2020-12/schema",
  "additionalProperties": false,
  "properties": {
    "captured_at": {
      "format": "date-time",
      "pattern": "^\\d{4}-\\d{2}-\\d{2}T\\d{2}:\\d{2}:\\d{2}Z$",
      "type": "string"
    },
    "chunks": {
      "items": {
        "additionalProperties": false,
        "properties": {
          "byte_length": {
            "minimum": 0,
            "type": "integer"
          },
          "file": {
            "minLength": 1,
            "type": "string"
          },
          "message_end": {
            "minimum": 1,
            "type": "integer"
          },
          "message_start": {
            "minimum": 1,
            "type": "integer"
          },
          "number": {
            "minimum": 1,
            "type": "integer"
          },
          "sha256": {
            "pattern": "^[a-f0-9]{64}$",
            "type": "string"
          }
        },
        "required": [
          "number",
          "file",
          "message_start",
          "message_end",
          "sha256",
          "byte_length"
        ],
        "type": "object"
      },
      "minItems": 1,
      "type": "array",
      "uniqueItems": true
    },
    "completeness": {
      "enum": [
        "complete",
        "partial"
      ]
    },
    "created_in": {
      "pattern": "^[A-Za-z][A-Za-z0-9_.:-]{1,127}$",
      "type": "string"
    },
    "extensions": {
      "propertyNames": {
        "pattern": "^[a-z0-9]+[.][a-z0-9_.-]+$"
      },
      "type": "object"
    },
    "format_version": {
      "const": "1"
    },
    "id": {
      "pattern": "^[A-Za-z][A-Za-z0-9_.:-]{1,127}$",
      "type": "string"
    },
    "instance_id": {
      "pattern": "^[A-Za-z][A-Za-z0-9_.:-]{1,127}$",
      "type": "string"
    },
    "kind": {
      "const": "log-manifest"
    },
    "missing_ranges": {
      "items": {
        "minLength": 1,
        "type": "string"
      },
      "minItems": 0,
      "type": "array",
      "uniqueItems": true
    },
    "original_byte_length": {
      "minimum": 0,
      "type": "integer"
    },
    "original_encoding": {
      "minLength": 1,
      "type": "string"
    },
    "original_file": {
      "minLength": 1,
      "type": "string"
    },
    "original_sha256": {
      "pattern": "^[a-f0-9]{64}$",
      "type": "string"
    },
    "scope_id": {
      "pattern": "^[A-Za-z][A-Za-z0-9_.:-]{1,127}$",
      "type": "string"
    },
    "source": {
      "minLength": 1,
      "type": "string"
    },
    "source_kind": {
      "enum": [
        "synthetic",
        "live",
        "import"
      ]
    },
    "started_at": {
      "anyOf": [
        {
          "format": "date-time",
          "pattern": "^\\d{4}-\\d{2}-\\d{2}T\\d{2}:\\d{2}:\\d{2}Z$",
          "type": "string"
        },
        {
          "type": "null"
        }
      ]
    },
    "time_note": {
      "type": [
        "string",
        "null"
      ]
    }
  },
  "required": [
    "format_version",
    "instance_id",
    "kind",
    "id",
    "scope_id",
    "source",
    "source_kind",
    "original_file",
    "original_sha256",
    "original_byte_length",
    "original_encoding",
    "captured_at",
    "started_at",
    "time_note",
    "completeness",
    "missing_ranges",
    "chunks",
    "created_in"
  ],
  "title": "Aniukas Lossless Memory profile 1: log-manifest",
  "type": "object"
}
